539,The Fundamental Atomic Constants,J. H. Sanders,Oxford University Press,1965,Second,,Progress Reports In Atomic Physics; Early Measurements; Light Velocity; Precise Measurements,Ex-Libris,,M
539,Modern Physics,M. S. Smith,Longmans,1960,,,Progress Reports In Atomic Physics; Motion; Ions And Atoms; Quantum Theory; Wave Mechanics; Electrons; X-Rays; Atomic Nucleus; Nuclear Theory,Ex-Libris,,Y
539,Introductory Nuclear Theory,L. R. B. Elton,Sir Isaac Pitman And Sons,1965,Second,,Progress Reports In Atomic Physics; Nuclei; Two Nucleon Systems; Nuclear Forces; Nuclear Models; Nuclear Reactions; Beta Decay; Meson Theory,Ex-Libris,,Y
539,Atomic Physics,E. V. Shpol'Skii,London Iliffe Books,1969,539,,Progress Reports In Atomic Physics; Electron; Isotopes; X-Ray; Atoms; Black Body; Energy Quanta; Energy Levels; Waves And Particles; Schrodinger Equations,Ex-Libris,,Y
539,Nuclei And Particles: An Introduction To Nuclear And Subnuclear Physics,Emilio Segre,W. A. Benjamin,1964,,,Progress Reports In Atomic Physics; Rutherford Scattering; Ionization In Gases; Straggling; Gamma Ray Passage; Positron Annhiliation; Detecting Nuclear Radiation; Particle Accelerators; Radioactive Decay; Alpha Emission; Gamma Emission; Beta Decay; Nuclear Reactions; Neutrons; Muons; Pions,Ex-Libris,,Y
539,The Properties Of Nuclei,G. A. Jones,Clarendon Press,1977,,,Progress Reports In Atomic Physics; Nuclei Properties; Nuclear Models; Forces; Spontaneous Decay; Fission; Fusion,,,Y
539,Modern Mass Spectrometry,G. P. Barnard,The Institute Of Physics,1953,,,Progress Reports In Atomic Physics; Positive Ion Beams; Vacuum Techniques; Mass Spectrometry Problems; Measuring Ion Beams; Hydrocarbon Analysis; Isotopic Tracer Techniques,Ex-Libris,,Y
539,Electron Impact Phenomena And The Properties Of Gaseous Ions,F. H. Field; J. L. Franklin,Academic Press,1970,,,Progress Reports In Atomic Physics; Ionization Cross Section; Mass Spectrometric Apparatus; Bond Strength; Negative Ions; Mass Spectral Considerations; Chemical Reaction Implications,,,Y
539,Elements Of Nuclear Physics,Franco Rasetti,Blackie And Son,1937,,,Progress Reports In Atomic Physics; Atom And Nucleus; Radiation; Radioactive Disintegration; Alpha Beta Gamma; Artificial Disintegration Of Nuclei; Cosmic Rays,Ex-Libris,,Y
531.1,Minerals and the Microscope, Herbert Gladstone Smith, Allen & Unwin,1968, 4th Revised edition,,General Physics; Petrological Microscope; Refraction In Minerals; Rock Forming Minerals,,,M
531.1,Physics Experiments Using Pcs,H. M. Staudenmaier,Springer,1995,,,General Physics; Mechanics; Thermodynamics; Solid State Physics; Optics; Atomic Physics; Nuclear Physics,,,M
531.1,The Physics of Rubber Elasticity (Monographs on the Physics and Chemistry of Materials), L. R. G Treloar, Oxford University Press,1975,3,,General Physics; Rubber Properties; Entropy Changes; Long Chain Molecules; Molecular Network Elasticity; Swelling Phenomena; Cross Links; Photoelastic Rubber Properties; Shear; Torsion; Gaussian Network,,,Y
531.1,Errors Of Observation And Their Treatment,J. Topping,Chapman And Hall Ltd,1965,Third,,General Physics; Obervational Error; Statistical Ideas; Error Theory,M,,M
531.1,The World Of High Pressure,John W. Stewart,D. Van Nostrand Co.,1967,,,General Physics; High Pressure Production; High Pressure Measurement; Pressure Volume Temperature; Electrical Effects Of High Pressure,,,Y
531.1,Elementary Physics,G. Stead,J. And A. Churchill Ltd,1948,Seventh,,General Physics; Units And Dimensions; Mechanics; Gravity; Friction; Hydrostatics; Matter Properties; Heat; Sound; Light; Electrostatics; Radioactivity; X-Ray,Seamus L. O'Connor,,Y
531.1,Air Currents And The Laws Of Ventilation,W. N. Shaw,Cambridge University Press,1907,,,General Physics; Flow In Air Circuits; Ventilated Spaces; Practical Ventilation,James T. Mcgukin,,Y
531.1,Thermodynamics,Gordon J. Van Wylen,John Wiley And Sons,1963,,,General Physics; Liquid Propellant Rocket; Thermodynamics; Pressure; Zeroth Law; Pure Substances; Work And Heat; First Law Of Thermodynamics; Second Law Of Thermodynamics; Entropy; Ideal Gas; Efficiency; Reciprocating Machine; Refrigeration Cycle; Nozzle Flow; Combustion; Equilibrium,,,Y
531.1,Kinematics And Dynamics Of Satellite Orbits,Various Authors,American Institute Of Physics,1963,,,General Physics; Orbits; Satellites; Research Papers,,,M
531.1,Handbook Of Chemistry And Physics,Robert C. Weast; Samuel M. Selby; Charles D. Hodgman,The Chemical Rubber Co.,1965,Forty Sixth,,General Physics; Chemistry Data; Isotopes; Calculus,,,M
531.1A,Lattice Theories Of The Liquid State,J. A. Barker,Pergamon Press,1963,,1,Properties Of Matter; Monte Carlo; Lennard Jones; Variational Theory; Cell Model; Cell Cluster Theory; Tunnel Theory; Radial Distribution Function; Quantum Effects,,,M
531.1A,Advanced Experiments In Practical Physics,J. E. Calthrop,William Heinemann,1952,Second,,Properties Of Matter; Matter And Heat Properties; Light; Electricity; Magnetism; Experiments,Ex-Libris,,Y
531.1A,Properties Of Matter,F. C. Champion; N. Davy,Blackie And Son,1944,,,Properties Of Matter; Units And Dimensions; Acceleration Due To Gravity; Newtonian Constants; Elasticity; Solid And Liquid Compression; Seismic Waves; Capillarity; Surface Films; Kinetic Theory; Osmotic Pressure; Diffusion; Viscosity; Errors,N. A. Porter,,Y
531.1B,Physical Similarity And Dimensional Analysis,W. J. Duncan,Edward Arnold,1955,,,Dimensional Analysis; Units; Geometry; Kinematic Similarity; Newtonian Dynamics; Dimensional Analysis; Fluid Motion; Pi Theorem; Heat; Electromagnetism,Ex-Libris,,
531.1A,An Introduction To The Liquid State,P. A. Egelstaff,Academic Press,1967,,,Properties Of Matter; Liquid Properties; Molecular Distribution Function; Equation Of State; Pair Potential Function; Equilibrium Properties; Space And Time Dependant Correlation; Diffusion; Velocity Correlation; Quantum Liquids,Ex-Libris,,Y
531.1A,Thin Film Physics., O.S. Heavens, Methuen young books,1970,,,Properties Of Matter; Film Preparation; Examining Film; Growth And Structure Of Film; Mechanical Properties; Optical Properties; Magnetic Properties; Electric Properties; Thin Film,Ex-Libris,,Y
531.1A,Physics Of High Pressures And The Condensed Phase,A. Van Itterbeek,North Holland Publishing Co.,1965,,,Properties Of Matter; High Pressure Techniques In General; Mechanical Properties Of Metals; Equation Of State Of Liquid Gas; Solidified Gas At High Pressure; Liquid State; Velocity Of Sound In Dense Fluids; Liquid Helium; Dolid Helium; Transport Phenomena; Absorption In Infra Red; Superconductivity,Ex-Libris,,Y
531.1A,The General Properties Of Matter,F. H. Newman; V. H. L. Searle,Edward Arnold,1951,Fourth,,Properties Of Matter; Gravity Acceleration; Gyroscopic Motion; Surface Tension; Viscosity; Fouriers Theorem; Osmosis; Diffusion; Equations Of Motion; Wave Motion; Units And Dimensions,N. A. Porter,,Y
531.1,Modern Physics,H. A. Wilson,Blackie And Son,1946,Second,,General Physics; Electron Theory; Magnetism; Thermionics; Photoelectricity; Quantum Theory; X-Ray; Gamma Rays; Optical Spectra; Positive Rays; Atomi Nuclei; Electron Motion In Gas; Atmospheric Electricity; Relativity,N. A. Porter,,Y
510,Statistics: A guide to the unknown (Holden-Day series in probability and statistics), Tanur Judith, Holden-Day,1978, 2nd,,Mathmatics; Statistics ; General Life,D. M. Duggan,,M
520,Solar System (Opus Books), Zdenek Kopal, Oxford University Press,1973,,,Astronomy; Major Planets; Earth; Venus; Mars; Mercury; Moon; Pluto; Asteroids; Comets; Origin Of Solar System,Ex-Libris,,Y
510,Mathematics For Engineers Part 2,W. N. Rose,Chapman And Hall,1945,Fourth,2,Mathmatics; Differentiation; Integration; Mean Values; Polar Coordinates; Harmonic Analysis; Least Squares,L. Jacob,Doesn'T Use Si,M
510,Textbook Of Fluids Dynamics,Frank Chorlton,D. Van Nostrand Co.,1967,,,Mathmatics; Vector Analysis; Kinematics Of Fluids; Equations Of Motion Of Fluids; Three Dimensional Flow; Thermodynamics; Gas Dynamics; Viscous Flow; Magnetohydrodynamics,D. Duggan,,
510,Calculus: One And Several Variables With Analytic Geometry Part 1,S. L. Salas; Einar Hille,John Wiley And Sons,1978,Third,1,Mathmatics; Limits; Continuity; Differentiation; Integration; Functions; Conic Sections; Polar Coordinates; Infinite Series; Sequences,,,Y
510,Real Analysis,Serge Lang,Addison Wesley Publishing,1973,,,Mathmatics; General Topology; Banach Spaces; Calculus; Functional Analysis; Integration; Global Analysis,,,Y
531.1A,A Text Book Of Physics,J. H. Poynting; J. J. Thomson,Charles Griffin And Co.,1922,Ninth,,Properties Of Matter; Weight ; Mass; Gravity; Elasticity; Strain; Torsion; Impact; Liquid Compressibility; Capillarity; Liquid And Gas Diffusion; Viscosity,N. A. Porter,,Y
531.1A,A General Degree Physics: The General Properties Of Matter,C. J. Smith,Edward Arnold,1953,,1,Properties Of Matter; Particle Dynamics; Rigid Dynamics; Simple Harmonic Motion; Gravity; Elasticity; Compressibility; Surface Tension; Flow; Vacuums,Ex-Libris,,Y
531.1A,Dynamics Of Real Fluids,E. G. Richardson,Edward Arnold,1961,Second,,Properties Of Matter; Small Viscosity; Compressible Fluid Flow; Hypersonic Flow; Aerodynamic Noise; Free Surface Fluids; Suspensions; Elastic Liquids; Magnetohydrodynamics,Ex-Libris,,Y
531.1A,The General Properties Of Matter,F. H. Newman; V. H. L. Searle,Edward Arnold,1963,Fifth,,Properties Of Matter; Gravity; Gyroscopic Motion; Elasticity; Surface Tension; Viscosity; Kinetic Theory Of Matter; Fouriers Theorem; Osmosis; Diffusion; Equations Of Motion; Wave Motion; Units; Dimensions,Myles O'Carm,,Y
531.1,"“The Emperor's New Mind: Concerning Computers, Minds, and the Laws of Physics”", Roger Penrose, Oxford University Press,1989, Reprint.,,General Physics; Algorithms; Turing Test; Proof; Hilberts Programme; Cosmology; Quantum Gravity; The Mind,Neil Porter,,M
538,Electricity and Magnetism, Betty I. Bleaney; B. Bleaney, Oxford University Press,1976, 3rd,,Electricity And Magnetism; Electrostatics; Current; Voltage; Magnetostatics; Dielectrics; Induction; Ac; Band Theory Of Metals; Superconductivity; Paramagnetism; Ferromagnetism; Semiconductors; Noise; Fluctuations,,,Y
,Electricity,Charles A. Coulson,Oliver And Boyd,1956,,,Electromag; Electrostatics; Dipoles; Conductors; Dielectrics; Permanent Magnets; Induction; Maxwells Equations; Ac,,,Y
,The Principles Of Electromagnetic Theory And Of Relativity,Marie Antoinette Tonnelat,D. Reidel Publishing Co.,1966,,,Electromag; Electrostatics; Magnetostatics; Lorentz Theory; Special Relativity; Relativistic Dynamics; Relativistic Kinematics; General Relativity,T. E. Nevin,,Y
,Electromangtic Fields And Interactions,Richard Becker,Blackie,1964,,1,Electromagnetic; Vectors; Tensor Calculus; Electrostatic Field; Dielectrics; Magnetic Field; Relativity,T. E. Nevin,,Y
,Electromagnetic Fields And Interactions,Richard Becker,Blackie,1964,,2,Electromag; Electron Theory; Hamiltonian; Quantum Mechanics; Electron Spin; Radiation; Absorption; Emission; Relativstic Electron,T. E. Nevin,,Y
,Makers Of Science: Electricity And Magnetism,D. M. Turner,Oxford University Press,1927,,,Electromag; Electrostatics; Induction; Electrolysis; Conducting Electricity Through Gas; Maxwell,T. E. Nevin,,Y
,Electromagnetism, I. S. Grant; W. R. Phillips, Wiley,1991,Second,,Electromag; Electrostatics; Dielectrics; Magnetic Field; Magnetic Materials; Induction; Ac; Linear Circuits; Maxwells Equations; Waveguide; Special Relativity,,,Y
,Modern Magnetism,L. F. Bates,Cambridge University Press,1951,Third,,Electromag; Magnetism; Magnetic Fields; Isotropic Substances; Crystals; Single Particles; Nuclear Spin; Gyromagnetic; Lattice And Spin Interaction; Hysterisis Cycle,T. E. Nevin,,Y
,Electricity And Magnetism,B. I. Bleaney; B. Bleaney,Oxford Clarendon Press,1957,,,Electromag; Electrostatics; Conductors; Induction; Ac; Thermionic Vacuum Tubes; Noise; Dielectric; Solid State Conduction; Paramagnetism; Ferromagnetism; Resonance,R. Burgess,,Y
,Theoretical Physics,Georg Joos,Blackie And Son,1934,,,Theoretical Physics; Vector Analysis; Mechanics; Optical Phenomena; Electricity; Heat; Structure Of Atoms And Molecules; Nuclear Physics,T. E. Nevin,,Y
,Theoretical Physics,W. Wilson,Methuen And Co.,1931,,1,Theoretical Physics; Tensor Analysis; Gauss ; Stokes; Fourier; Dynamics; Wave Propagation; Elasticity; Hydrodynamics; Viscous Fluid; Statistical Mechanics; Thermodynamics,T. E. Nevin,,Y
,Theoretical Physics,Georg Joos; Ira M. Freeman ,Blackie And Son,1958,Third,,Theoretical Physics; Vector Analysis; Vibrations And Waves; Functions Of Complex Variable; Single Particle Mechanics; Magnetostatic Field; Homogenous Isotropic Media; Diffraction; Interference Optics; Electrolytic Conduction; Metallic Conduction; Moving Bodies; Thermodynamic Systems; Nernst Heat Theorem; Boltzmann; Bose Einstein; Fermi Dirac; Nuclear Physics; Elastomers,Michael Hoey,,Y
,"Units and Standards for Electromagnetism (The Wykeham science series, 15)", P. Vigoureux; R.A.R. Tricker, Taylor & Francis Ltd,1971,,,Electromag; Units; Material Standards; Comparison Of Standards,T. E. Nevin,,M
,Fundamentals of Electromagnetics for Electrical and Computer Engineering, Nannapaneni Narayana Rao, Pearson,,,,Electromag; Maxwells Equations; Wave Propagation; Waveguide ; Antenna Basis,,,Y
,Foundations Of Electromagnetic Theory,John R. Reitz; Frederick J. Milford,Addison-Wesley Publishing Co.,1960,,,Electromag; Vector Analysis; Electrostatics; Dielectrics; Current; Induction; Magnetic Properties; Plasma Physics; Maxwells Equations; Electrodynamics,Michael J. Hoey,,Y
 ,Classical Electricity And Magnetism,Wolfgang K. H. Panofsky; Melba Phillips,Addison-Wesley Publishing Co.,1955,,,Electromag; Electrostatic Field; Potential Problems; Currents; Maxwells Equations; Wave Equation; Special Relativity; Covariance; Radiation; Hamiltonian Form,Paul Allen,,Y
,"College Physics: Electricity, Magnetism and Optics",Francis Weston Sears; Mark W. Zemansky,Addison Wesley Publishing,1957,Second,2,Electromag; Coloumb; Dielectrics; Induction; Illumination; Colour; Interference; Diffraction; Spectra; Nuclear Physics,T. E. Nevin,,Y
,Foundations Of Electromagnetic Theory,John R. Reitz; Frederick J. Milford,Addison Wesley Publishing,1967,Second,,Electromag; Vector Analysis; Electrostatics; Dielectrics; Current; Induction; Magnetic Properties; Plasma Physics; Maxwells Equations; Electrodynamics; Superconductors; Special Relativity,T. E. Nevin,,Y
,Microwave Transmission,J. C. Slater,Dover Publications,1959,,,Electromag; Transmission Lines; Maxwells Equations; Waveguide; Antenna Radiation; Coupling of Coaxial Lines,Michael J. Hoey,,Y
,Wave Mechanics,H. T. Flint,Methuen And Co.,1967,,,Electromag; Dynamics; Optics; Wave Function; Schrodinger Matrices; Angular Momentum,T. E. Nevin,,Y
,"Electricity, Magnetism and Atomic Physics: Electricity and Magnetism",J. H. Fewkes; John Yarwood,University Tutorial Press,1956,,1,Electromag; Dimensions and Units; Dielectrics; Electrolysis; Thermoelectricity; Circuits; Vector Analysis,Paul Allen,,Y
,Electricity and Matter,J. J. Thomson,Yale University Press,1904,,,Electromag; Atomic Structure; Atom; Radioactivity; Bound Mass,T. E. Nevin,,Y
,Elementary Wave Mechanics,W. Heitler,Oxford Clarendon Press,1945,,,Electromag; Wave Equation; Quantum Mechanics; Hydrogen Atom; Zeeman Effect; Two Electron Problem; Perturbation Theory; Homopolar Chemical Bond; Valency,T. E. Nevin,,Y
,Introduction to Electromagnetic Fields and Waves,Dale R. Corson; Paul Lorrain,W. H. Freeman and Co.,1962,,,Electromag; Vectors; Electrostatic Fields; Dielectrics; Magnetic Fields; Electromotance; Maxwells Equations; Reflection; Refraction; Guidewave,T. E. Nevin,,Y
,Particle Physics: The High Energy Frontier,M. Staneley Livingston,McGraw-Hill Book Co. ,1968,,,Particle; Nuclear Atom; Quanta; Parity; Isotopic Spin; Strangeness; Resonances; Basic Symmetry,Alex Montwill,,Y
,The Fundamental Particles,C. E. Swartz,Addison Wesley Publishing,1965,,,Particle; Bohr Atom; Electron; Interactions; Conservation Laws; Resonance; Short Lived Particles,Peter Mitchill,,Y
,Meson Theory of Nuclear Forces,Wolfgang Pauli,Interscience Publishers,1946,,,Particle; Meson Fields; Vector Field Theory; Meson Scattering; Quantum Scattering; Heisenberg; Neutron Proton Scattering; Strong Coupling Theory,T. E. Nevin,,Y
,Elementary Particle Physics,Stephen Gasiorowicz,John Wiley And Sons,1966,,,Particle; Dirac Field; Scalar Field; Mesons; Photons; Lorentz Invariance; Scattering Matrix; Compton Effect; Bremsstrahlung; Perturbation Theory; Baryons; Eightfold Way; Boson Resonance; Partial Wave Amplitudes; Dynamical Origin of Resonances; Beta Decay; Beta Interaction; Weak Interaction,Alex Montwill,,Y
,Theoretical Mechanics: Statics and The Dynamics of a Particle,William Duncan MacMillan,Dover Publications,1958,,,Particle; Vectors; Velocity; Mass And Force; Work And Energy; Gravity Center; Inertia Moments; Statics of Rigid Bodies; Virtual Work; Deformable Bodies; Particle Dynamics; Curvliniear Motion; Central Forces; Constrained Motion; Lagrange; Hamilton Canonical Equations, ,,Y
,Quantum Electrodynamics, Gunnar Kallen, Allen & Unwin,1973,,,Particle; Free Electromagnetic Field; Free Dirac Field; Perturbation Theory; Radiative Corrections; Renormalization,T. E. Nevin,,Y
,Molecules and Motion,Jon Ogborn,Nuffield Physics Special,1973,,,Particle; Molecules and Gasses; Boyle,T. E. Nevin,,Y
,The Fundamental Constants and Quantum Electrodynamics,B. N. Taylor; W. H. Parker; D. N. Langenberg,Academic Press,1969,,,Particle; Fundamental Constants; Auxiliary Constants; Least Square; QED,T. E. Nevin,,Y
,Electron Physics: The Physics of the Free Electron,O. Klemperer,Butterworths,1961,,,Particle; Electron Motion; Electron Flow; Cathode Ray Detection; Electron Mass; Wave Nature of Electron; Spin; Magnetic Moment,T. E. Nevin,,Y
,The Cyclotron,W. B. Mann,Methuen And Co.,1940,,,Particle; Magnetic Resonance Acceleration; Cyclotron Vacuum Chamber; Ion Source; Magnetic Focusing,T. E. Nevin,,Y
,The Principles of Cloud-Chamber Technique,J. G. Wilson,Cambridge University Press,1951,,,Particle; Condesation; Ionization; Supersaturation; Counter Control; Cloud Chamber Photography,T. E. Nevin,,Y
,Band Spectra and Molecular Structure,R. De L. Kronig,Cambridge University Press,1930,,,Optics; Diatomic Molecules; Fine Structure; Macroscopic Properties; Chemical Binding,T. E. Nevin,,Y
,Optical Andecdotes,D. J. Lovell,Spie,1984,,,Optics; History; Anecdotes,,,M
,Fudamentals of Physics Optics,Francis A. Jenkins; Harvey E. White,McGraw-Hill Book Co. ,1937,,,Optics; Superposition of Waves; Interference; Fraunhoffer; Double Slit; Diffraction Grating; Fresnel; Absorption and Scattering; Dispersion; Polarization; Magnto-optics,T. E. Nevin,,Y
,Nature Series: Polarisation of Light,William Spottiswoode,Spottiswoode and Co.,1883,Fourth,,Optics; Polarization; Polariscopes; Wave Theory; Circular Polarization; Atmospheric Polarisation; Colour,,,Y
,Radiation and Optics,John M. Stone,McGraw-Hill Book Co. ,1963,,,Optics; Vector Analysis; Sinusoidal Oscillations; Microscopic Maxwell Equation; Energy Flow; Monochromatic Dipole Radiation; Fraunhoffer; Kirchhoff; Fresnel; Fourier Analysis; Lorentz Atoms; Polychromatic Waves; Scattering; Reflection; Transmission; Double Refraction; Magnetoptics,T. E. Nevin,,Y
,Diffraction: Coherence in Optics,M. Francon,Pergamon Press,1966,,,Optics; Huygens; Diffraction; Monochromatic Point Source; Aperture; Fourier Transformation; Coherence; Optical Instrument,,,Y
,Physics Optics,Robert W. Wood,The Macmillan Company,1923,,,Optics; Rectilinear Propagation; Refraction of Light; Dispersion; Interference; Diffraction; Spectroscopes; Polarization; Dispersion; Absorption of Light; Radiation; White Light,T. E. Nevin,Talks about Ether,Y
,High Power Gas Lasers,Various Authors,Institute of Physics Conference Series,1975,,,Optics; Research Papers; Lasers; Gas ,,,Y
,Wave Mechanics,H. T. Flint,Methuen And Co.,1929,,,Waves; Dynamics; Mechanical Waves; Wave Function,T. E. Nevin,,Y
,Wave Filters,L. C. Jackson,Methuen And Co.,1944,,,Waves; Wave Filters; Filter Construction; Acoustic,T. E. Nevin,,M
,Wave Guides,H. R. L. Lamont,Methuen And Co.,1946,Second,,Waves; Waveguide; Attenuation; Stability; Radiators,T. E. Nevin,,M
,Acoustics for Musicians,Percy C. Buck,Oxford Clarendon Press,1918,,,Waves; Pitch; Intensity; Quality; Temperament; Transmission,T. E. Nevin,,M
,Vibrations and Waves,Norman Feather,Penguin Books,1961,,,Waves; Stretched Strings; Coupled Vibrations; Elastic Vibrations; Plane Waves; Water Waves; Interference; Diffraction; Wave Particle Duality,T. E. Nevin,,Y
,"Vibrations, Waves and Diffraction",H. J. J. Braddick,McGraw-Hill Book Co. ,1965,,,Waves; Harmonic Oscillators; Forced Oscillations; Fourier Analysis; Group Velocity; Stationary Wave Patterns; Reflection; Huygens Principle; Diffraction,T. E. Nevin,,Y
,Mechanical Vibrations,J. P. Den Hartog,McGraw-Hill Book Co. ,1956,,,Waves; Kinematics; Degrees of Freedom; Multicylinder Engines; Rotating Machinery; Self Excited Vibrations,L. Jacob,,Y
,Waves,C. A. Coulson,Oliver And Boyd,1961,Seventh,,Waves; Wave Equation; Strings; Waves in Membranes; Liquid Waves; Sound Waves; Electric Waves,T. E. Nevin,,Y
,Sound,R. C. Brown,Longmans,1954,,,Waves; Vibratory Motion; Sound Wave Propagation; Wave Behaviour; Forced Vibrations; Sound,T. E. Nevin,,Y
,Sound,R. C. Brown,Longmans,1954,,,Waves; Vibratory Motion; Sound Wave Propagation; Wave Behaviour; Forced Vibrations; Sound,T. E. Nevin,,Y
,Vibrations and Waves,Norman Feather,Penguin Books,1961,,,Waves; Stretched Strings; Coupled Vibrations; Elastic Vibrations; Plane Waves; Water Waves; Interference; Diffraction; Wave Particle Duality,T. E. Nevin,,Y
,Wave Filters,L. C. Jackson,Methuen And Co.,1944,Second,,Waves; Wave Filters; Filter Construction; Acoustic,T. E. Nevin,,M
,Wave Guides,H. R. L. Lamont,Methuen And Co.,1946,Third,,Waves; Waveguide; Attenuation; Stability; Radiators,T. E. Nevin,,M
,Principles of Modern Acoustics,George W. Swenson,D. Van Nostrand Co.,1953,,,Waves; Vibating String; Membrane; Acoustic; Radiators; Speech and Hearing,T. E. Nevin,,Y
,Light and Sound ,C. O'Donoghue,C. J. Fallon,1971,,,Waves; Wavemotion; Reflection; Dispersion; Colour; Spectra; Interference; Diffaction; Polarisation; Sound,,,Y
,Principles of Radar,Members of Radar School Massachusetts,McGraw-Hill Book Co. ,1946,Second,,Waves; Timing Circuits; Indicators; Receivers; Magnetrons; Modulator; Triode Transmission; Radio Frequency Lines; Radar Antennas; Cavity Resonators; Synchros,T. E. Nevin,,M
,Waves and Oscillations,Frank S. Crawford,McGraw-Hill Book Co. ,1966,,3,Waves; Degrees of Freedom; Linearity; Superposition; Beats; Oscillations; Dispersion Relation,T. E. Nevin,,Y
,Classical Mechanics,J. W. Leech,Methuen And Co.,1965,,,Classical Mech; Lagrangian Equation; Hamiltonian Form; Transformation Theory; Poisson Brackets; Continuous System; Relavtistic Mechanics,L. Jacob,,Y
,Intermediate Mechanics,D. Humphrey,"Longmans, Greena and Co. ",1948,,,Classical Mech; Momentum; Projectiles; Circular Motion; Rigid Body Motion,L. Jacob,,Y
,Dynamics Part 1,A. S. Ramsey,Cambridge University Press,1962,Second,1,Classical Mech; Vectors; Dynamics; Kinematics; Harmonic Motion; Constrained Motion; Poolar Coordinates; Moments of Inertia; Oscillations,L. Jacob,,Y
,Schaum's Outline of Theory and Problems of Theoretical Mechanics,Murray R. Spiegel,McGraw-Hill Book Co. ,1967,,,Classical Mech; Vectors; Newtons Laws of Motion; Uniform Field Motion; Harmonic Oscillations; Planetary Motion; Space Motion; Hamiltonian Theory; Lagranges Equations,,,Y
,"Mass, Length and Time",Norman Feather,Penguin Books,1959,,,Classical Mech; Length; Time; One Dimensional Motion; Simple Harmonic Motion; Planerary Motion; Gravitation; Collisions; Elasticity; Surface Tension; Heat and Energy,T. E. Nevin,,Y
,Classical Mechanics,H. C. Corben; Philip Stehle,John Wiley And Sons,1960,Second,,Classical Mech; Laws of Motion; Kinematics; Degrees of Freedom; Lagranges Equations; Small Oscillations; Rigid Bodies; Hamiltonian Theory; Hamilton-Jacobi; Transformation Theory; Special Relativity,Paul Allen,,Y
,An Elementary Treatise on Statics,S. L .Loney,Cambridge University Press,1951,Second,,Classical Mech; Parallel Forces; Friction; Work; Shearing Stress; Gravity; Unstable Equilibrium; Nul Lines; Potential; Attraction; Clapeyrons Equation,Alexander Montwill,,Y
,Theory of Electrons,L. Rosenfeld,North Holland Publishing Co.,1950,,,Classical Mech; Maxwells Theory; Dynamical Properties; Magnetic Properties; Polarization; Optical Dispersion,T. E. Nevin,,Y
,Mechanics,Keith R. Symon,Addison Wesley Publishing,1967,,,Classical Mech; Newtonian Mechanics; Dimensions; Rigid Bodies; Gravity; Continuous Media; Lagrange,T. E. Nevin,,Y
,Geometrical Optics,L. C. Jackson,Sir Isaac Pitman And Sons,1955,,,Optics; Geometrical Optics; Photometry; Abberations; Optical Instruments,,,Y
,Optical Physics,S. G. Lipson; H. Lipson,Cambridge University Press,1969,,,Optics; Waves; Fourier Theory; Polarization; Diffraction; Fraunhoffer; Coherence; Classical Theory of Dispersion; Quantum Optics,T. E. Nevin,,Y
,Optical Masers,O. S. Heavens,Methuen And Co.,1964,,,Optics; Optical Masers; Gaseous Masers,T. E. Nevin,,Y
,"“The Diffraction of Light, X-rays, And Material Particles”",Charles F. Meyer,The University Of Chicago Press,1934,,,Optics; Fresnel Zones; Zone Methods; Lunes Method; Cornu Spiral; Fraunhoffer; Diffraction Grating; X-ray Diffraction; Particle Diffraction,T. E. Nevin,,Y
,A Treatise on Light,R. A. Houstoun ,"Longmans, Green and Co. ",1925,Fourth,,Optics; Spherical Mirrors and Lenses; Image Defects; Optical Instruments; Interference; Diffraction; Propagation of Light in Crystals; Spectroscopy; Photometry; Colour; Nature of Light; Reflection; Refraction; Radiation; ,T. E. Nevin,Talks about Ether,Y
